样本编号,姓名或化名,地区,角色,入行背景,从业时间,服务量,经营/服务特征,主要困难,证据摘录,来源,可信度
P01,王英豪,北京/公开访谈,宠物殡葬师/作者,家具设计师转行，从学徒到开店,从业约5-6年,未披露,将宠物殡葬定位为情感服务，记录案例并出版《作为它的殡葬师》,选址、从零学习、情感劳动,从家具设计师转行，从零基础开始当学徒到自己选址开店；认为行业本质是情感服务,https://www.thepaper.cn/newsDetail_forward_33011901,B
P02,橘子,北京丰台,宠物殡葬师/店长,自己的小狗去世后到北京送别，萌生入行想法,2018年7月入行，采访时从业4年多,未披露,经过3个月培训后独立上手，后成为宠慕丰台店店长,职业培训缺少统一认证,为了给自己养的小狗一个体面的葬礼来到北京；3个月前期培训后独立上手,https://news.cctv.com/2022/01/06/ARTIcjVB3o1YrGcLF64nuIcG220106.shtml,A
P03,李超,北京,宠物殡葬馆经营者,爱犬去世后考察多家殡葬公司，觉得处理粗糙，后创办宠慕,2015年开店，采访时约6年,未披露,服务猫狗外也服务金鱼、蜥蜴、羊等宠物主人,选址难、低频消费、盈利周期长,至少干两到三年以上才能看见收益；店员月收入与普通上班族无异,https://zqb.cyol.com/html/2022-01/11/nw.D110000zgqnb_20220111_2-05.htm,A
P04,俊光,北京,宠物殡葬馆经营者,经营彩虹星球宠物殡葬馆,采访时已搬迁,未披露,曾开在产业园，因告别室哭声影响邻里被投诉后搬迁,选址、邻避效应、盈利困难,宠物殡葬师更像心理疏导师，门槛低但要求共情性高,https://zqb.cyol.com/html/2022-01/11/nw.D110000zgqnb_20220111_2-05.htm,A
P05,吕骏,深圳,宠物殡葬从业者,受“彩虹桥”叙事影响，重视安抚宠主,2015年至2021年从业6年,未披露,认为比处理尸体更重要的是安抚宠主情绪,行业参差不齐、标准不足,有时候殡葬师也会忍不住在过程中落泪,https://epaper.oeeee.com/epaper/H/html/2021-11/05/content_22976.htm,A
P06,阳慧,深圳,宠物殡葬师,公开报道中进行小猫告别仪式,2021年报道,未披露,参与告别仪式服务,行业标准与监管不足,报道图片说明：阳慧在帮一只小猫进行告别仪式,https://epaper.oeeee.com/epaper/H/html/2021-11/05/content_22976.htm,A
P07,谭景元,重庆两江新区,宠物生命纪念馆创始人,创办拾光森林宠物生命纪念馆,2024年7月开业后至2025年6月,已服务500多只；高峰月单量约80只,约300平方米空间，多功能区，基础套餐几百元，定制服务几千至数万元,价格透明、资质与信任建设,去年7月开业，已服务500多只宠物，多的时候一个月单量80只左右,https://www.news.cn/politics/20250612/9c509c65a8424e318ba83af4c05074a9/c.html,A
P08,姜先生,未披露/扬子晚报报道,宠物殡葬师,在腾讯热问讲述行业故事和特殊告别,2026年报道,未披露,讲述主人与宠物的特殊告别,公众认知和行业规范,宠物早已成为许多家庭不可或缺的一员，宠物殡葬承载思念与告别,https://www.yzwb.net/news/sh/202604/t20260404_338863.html,B
